16:38:02.093413 IP 10.11.3.3.60862 > 157.55.235.168.40011: Flags [S], seq 3440346602, win 13600, options [mss 1360,sackOK,TS val 1831516 ecr 0,nop,wscale 5], length 0
16:38:02.094914 IP 10.11.3.3.24462 > 172.16.0.23.53: 18133+ AAAA? dsn2.d.skype.net. (34)
16:38:02.174858 IP 157.55.235.168.40011 > 10.11.3.3.60862: Flags [S.], seq 58684644, ack 3440346603, win 14480, options [mss 1460,sackOK,TS val 2276424100 ecr 1831516,nop,wscale 9], length 0
16:38:02.188194 IP 10.11.3.3.60862 > 157.55.235.168.40011: Flags [.], ack 1, win 425, options [nop,nop,TS val 1831535 ecr 2276424100], length 0
16:38:02.190959 IP 10.11.3.3.60862 > 157.55.235.168.40011: Flags [P.], seq 1:67, ack 1, win 425, options [nop,nop,TS val 1831536 ecr 2276424100], length 66
16:38:02.220517 IP 157.55.235.168.40011 > 10.11.3.3.60840: Flags [F.], seq 2883775739, ack 1525526196, win 69, options [nop,nop,TS val 2276424112 ecr 1823723], length 0
16:38:02.234296 IP 10.11.3.3.60840 > 157.55.235.168.40011: Flags [.], ack 1, win 559, options [nop,nop,TS val 1831545 ecr 2276424112], length 0
16:38:02.234307 IP 10.11.3.3.60840 > 157.55.235.168.40011: Flags [FP.], seq 1, ack 1, win 559, options [nop,nop,TS val 1831545 ecr 2276424112], length 0
16:38:02.272444 IP 157.55.235.168.40011 > 10.11.3.3.60862: Flags [.], ack 67, win 29, options [nop,nop,TS val 2276424124 ecr 1831536], length 0
16:38:02.276991 IP 157.55.235.168.40011 > 10.11.3.3.60862: Flags [P.], seq 1:55, ack 67, win 29, options [nop,nop,TS val 2276424125 ecr 1831536], length 54
16:38:02.291107 IP 10.11.3.3.60862 > 157.55.235.168.40011: Flags [.], ack 55, win 425, options [nop,nop,TS val 1831556 ecr 2276424125], length 0
16:38:02.294134 IP 10.11.3.3.60862 > 157.55.235.168.40011: Flags [P.], seq 67:75, ack 55, win 425, options [nop,nop,TS val 1831556 ecr 2276424125], length 8
16:38:02.312912 IP 172.16.0.23.53 > 10.11.3.3.24462: 18133 1/1/0 CNAME dsn2.skype-dsn.akadns.net. (136)
16:38:02.314480 IP 157.55.235.168.40011 > 10.11.3.3.60840: Flags [.], ack 2, win 69, options [nop,nop,TS val 2276424135 ecr 1831545], length 0
16:38:02.372527 IP 157.55.235.168.40011 > 10.11.3.3.60862: Flags [P.], seq 55:63, ack 67, win 29, options [nop,nop,TS val 2276424149 ecr 1831556], length 8
16:38:02.417119 IP 157.55.235.168.40011 > 10.11.3.3.60862: Flags [.], ack 75, win 29, options [nop,nop,TS val 2276424161 ecr 1831556], length 0
16:38:02.531656 IP 10.11.3.3.60862 > 157.55.235.168.40011: Flags [P.], seq 75:138, ack 63, win 425, options [nop,nop,TS val 1831584 ecr 2276424149], length 63
16:38:02.613013 IP 157.55.235.168.40011 > 10.11.3.3.60862: Flags [P.], seq 63:124, ack 138, win 29, options [nop,nop,TS val 2276424209 ecr 1831584], length 61
16:38:02.626865 IP 10.11.3.3.60862 > 157.55.235.168.40011: Flags [P.], seq 138:182, ack 124, win 425, options [nop,nop,TS val 1831623 ecr 2276424209], length 44
16:38:02.708642 IP 157.55.235.168.40011 > 10.11.3.3.60862: Flags [P.], seq 124:127, ack 182, win 29, options [nop,nop,TS val 2276424233 ecr 1831623], length 3
16:38:02.769179 IP 10.11.3.3.60862 > 157.55.235.168.40011: Flags [.], ack 127, win 425, options [nop,nop,TS val 1831652 ecr 2276424233], length 0
16:38:02.850817 IP 157.55.235.168.40011 > 10.11.3.3.60862: Flags [P.], seq 127:271, ack 182, win 29, options [nop,nop,TS val 2276424269 ecr 1831652], length 144
16:38:02.874775 IP 10.11.3.3.60862 > 157.55.235.168.40011: Flags [.], ack 271, win 459, options [nop,nop,TS val 1831673 ecr 2276424269], length 0
16:38:02.877040 IP 10.11.3.3.60862 > 157.55.235.168.40011: Flags [P.], seq 182:186, ack 271, win 459, options [nop,nop,TS val 1831673 ecr 2276424269], length 4
16:38:02.916959 IP 134.170.24.93.443 > 10.11.3.3.57158: Flags [F.], seq 3069534946, ack 3288086060, win 64194, options [nop,nop,TS val 135303572 ecr 1822246], length 0
16:38:02.920811 IP 10.11.3.3.7416 > 213.199.179.159.40023: UDP, length 41
16:38:02.921001 IP 10.11.3.3.7416 > 111.221.74.32.40029: UDP, length 41
16:38:02.921283 IP 10.11.3.3.7416 > 64.4.23.159.40023: UDP, length 41
16:38:02.923860 IP 10.11.3.3.7416 > 157.56.52.22.40011: UDP, length 428
16:38:02.924169 IP 10.11.3.3.7416 > 111.221.74.22.40011: UDP, length 428
16:38:02.927433 IP 10.11.3.3.7416 > 111.221.77.165.40028: UDP, length 428
16:38:02.931890 IP 10.11.3.3.7416 > 157.55.235.150.40011: UDP, length 428
16:38:02.931901 IP 10.11.3.3.7416 > 157.55.56.159.40023: UDP, length 428
16:38:02.931906 IP 10.11.3.3.7416 > 64.4.23.159.40023: UDP, length 428
16:38:02.932002 IP 10.11.3.3.7416 > 111.221.74.32.40029: UDP, length 428
16:38:02.932351 IP 10.11.3.3.7416 > 213.199.179.159.40023: UDP, length 428
16:38:02.932365 IP 10.11.3.3.7416 > 111.221.77.159.40023: UDP, length 428
16:38:02.933854 IP 10.11.3.3.7416 > 65.55.223.33.40001: UDP, length 428
16:38:02.933866 IP 10.11.3.3.7416 > 157.55.56.175.40023: UDP, length 428
16:38:02.933878 IP 10.11.3.3.7416 > 157.55.235.161.40001: UDP, length 428
16:38:02.934302 IP 10.11.3.3.7416 > 157.56.52.45.40024: UDP, length 428
16:38:02.934313 IP 10.11.3.3.7416 > 65.55.223.45.40024: UDP, length 428
16:38:02.934319 IP 10.11.3.3.7416 > 111.221.74.45.40023: UDP, length 428
16:38:02.934325 IP 10.11.3.3.7416 > 157.55.235.173.40024: UDP, length 428
16:38:02.934352 IP 10.11.3.3.7416 > 111.221.74.15.40004: UDP, length 428
16:38:02.936418 IP 65.55.223.33.40001 > 10.11.3.3.7416: UDP, length 11
16:38:02.937032 IP 65.55.223.45.40024 > 10.11.3.3.7416: UDP, length 11
16:38:02.941284 IP 10.11.3.3.57158 > 134.170.24.93.443: Flags [.], ack 1, win 48528, options [nop,nop,TS val 1831686 ecr 135303572], length 0
16:38:02.941293 IP 10.11.3.3.57158 > 134.170.24.93.443: Flags [FP.], seq 1, ack 1, win 48528, options [nop,nop,TS val 1831686 ecr 135303572], length 0
16:38:02.948906 IP 157.55.56.159.40023 > 10.11.3.3.7416: UDP, length 11
16:38:02.948944 IP 134.170.24.93.443 > 10.11.3.3.57158: Flags [.], ack 2, win 64194, options [nop,nop,TS val 135303575 ecr 1831686], length 0
16:38:02.950494 IP 10.11.3.3.7416 > 65.55.223.33.40001: UDP, length 433
16:38:02.950643 IP 157.55.56.175.40023 > 10.11.3.3.7416: UDP, length 11
16:38:02.952079 IP 10.11.3.3.7416 > 65.55.223.45.40024: UDP, length 433
16:38:02.953029 IP 65.55.223.33.40001 > 10.11.3.3.7416: UDP, length 17
16:38:02.954615 IP 65.55.223.45.40024 > 10.11.3.3.7416: UDP, length 17
16:38:02.962025 IP 10.11.3.3.7416 > 157.55.56.159.40023: UDP, length 433
16:38:02.966689 IP 10.11.3.3.7416 > 157.55.56.175.40023: UDP, length 433
16:38:02.968547 IP 10.11.3.3.7416 > 65.55.223.33.40001: UDP, length 11
16:38:02.969177 IP 10.11.3.3.7416 > 65.55.223.45.40024: UDP, length 11
16:38:02.970939 IP 65.55.223.33.40001 > 10.11.3.3.7416: UDP, length 22
16:38:02.971538 IP 65.55.223.45.40024 > 10.11.3.3.7416: UDP, length 22
16:38:02.978667 IP 157.55.56.159.40023 > 10.11.3.3.7416: UDP, length 17
16:38:02.983352 IP 157.55.56.175.40023 > 10.11.3.3.7416: UDP, length 17
16:38:02.985554 IP 64.4.23.159.40023 > 10.11.3.3.7416: UDP, length 11
16:38:02.990809 IP 157.56.52.22.40011 > 10.11.3.3.7416: UDP, length 11
16:38:02.992682 IP 10.11.3.3.7416 > 157.55.56.159.40023: UDP, length 11
16:38:02.996281 IP 64.4.23.159.40023 > 10.11.3.3.7416: UDP, length 11
16:38:02.996780 IP 10.11.3.3.7416 > 157.55.56.175.40023: UDP, length 11
16:38:02.997237 IP 157.55.235.168.40011 > 10.11.3.3.60862: Flags [.], ack 186, win 29, options [nop,nop,TS val 2276424306 ecr 1831673], length 0
16:38:03.001339 IP 157.56.52.45.40024 > 10.11.3.3.7416: UDP, length 11
16:38:03.002253 IP 10.11.3.3.7416 > 64.4.23.159.40023: UDP, length 46
16:38:03.004637 IP 10.11.3.3.7416 > 157.56.52.22.40011: UDP, length 433
16:38:03.009159 IP 157.55.56.159.40023 > 10.11.3.3.7416: UDP, length 22
16:38:03.010725 IP 10.11.3.3.7416 > 64.4.23.159.40023: UDP, length 433
16:38:03.012254 IP 10.11.3.3.60862 > 157.55.235.168.40011: Flags [P.], seq 186:1248, ack 271, win 459, options [nop,nop,TS val 1831700 ecr 2276424306], length 1062
16:38:03.013284 IP 157.55.56.175.40023 > 10.11.3.3.7416: UDP, length 22
16:38:03.014987 IP 157.55.235.161.40001 > 10.11.3.3.7416: UDP, length 11
16:38:03.015023 IP 157.55.235.150.40011 > 10.11.3.3.7416: UDP, length 11
16:38:03.015364 IP 10.11.3.3.7416 > 157.56.52.45.40024: UDP, length 433
16:38:03.018257 IP 213.199.179.159.40023 > 10.11.3.3.7416: UDP, length 11
16:38:03.019682 IP 157.55.235.173.40024 > 10.11.3.3.7416: UDP, length 11
16:38:03.029505 IP 213.199.179.159.40023 > 10.11.3.3.7416: UDP, length 11
16:38:03.030172 IP 10.11.3.3.7416 > 157.55.235.161.40001: UDP, length 433
16:38:03.031704 IP 10.11.3.3.7416 > 157.55.235.150.40011: UDP, length 433
16:38:03.034027 IP 10.11.3.3.7416 > 213.199.179.159.40023: UDP, length 46
16:38:03.036317 IP 10.11.3.3.7416 > 157.55.235.173.40024: UDP, length 433
16:38:03.042991 IP 10.11.3.3.7416 > 213.199.179.159.40023: UDP, length 433
16:38:03.066668 IP 64.4.23.159.40023 > 10.11.3.3.7416: UDP, length 21
16:38:03.071766 IP 157.56.52.22.40011 > 10.11.3.3.7416: UDP, length 17
16:38:03.074884 IP 64.4.23.159.40023 > 10.11.3.3.7416: UDP, length 17
16:38:03.079914 IP 10.11.3.3.7416 > 64.4.23.159.40023: UDP, length 11
16:38:03.082312 IP 157.56.52.45.40024 > 10.11.3.3.7416: UDP, length 17
16:38:03.084739 IP 10.11.3.3.7416 > 157.56.52.22.40011: UDP, length 11
16:38:03.088026 IP 10.11.3.3.7416 > 64.4.23.159.40023: UDP, length 11
16:38:03.093966 IP 157.55.235.168.40011 > 10.11.3.3.60862: Flags [.], ack 1248, win 33, options [nop,nop,TS val 2276424330 ecr 1831700], length 0
16:38:03.094001 IP 157.55.235.168.40011 > 10.11.3.3.60862: Flags [P.], seq 271:275, ack 1248, win 33, options [nop,nop,TS val 2276424330 ecr 1831700], length 4
16:38:03.094987 IP 10.11.3.3.7416 > 157.56.52.45.40024: UDP, length 11
16:38:03.111594 IP 157.55.235.161.40001 > 10.11.3.3.7416: UDP, length 17
16:38:03.114816 IP 157.55.235.150.40011 > 10.11.3.3.7416: UDP, length 17
16:38:03.121681 IP 157.55.235.173.40024 > 10.11.3.3.7416: UDP, length 17
16:38:03.131435 IP 213.199.179.159.40023 > 10.11.3.3.7416: UDP, length 21
16:38:03.140135 IP 213.199.179.159.40023 > 10.11.3.3.7416: UDP, length 17
16:38:03.144057 IP 64.4.23.159.40023 > 10.11.3.3.7416: UDP, length 26
16:38:03.146973 IP 111.221.77.165.40028 > 10.11.3.3.7416: UDP, length 11
16:38:03.150206 IP 10.11.3.3.7416 > 157.55.235.173.40024: UDP, length 11
16:38:03.151393 IP 157.56.52.22.40011 > 10.11.3.3.7416: UDP, length 22
16:38:03.152482 IP 64.4.23.159.40023 > 10.11.3.3.7416: UDP, length 22
16:38:03.156456 IP 111.221.74.32.40029 > 10.11.3.3.7416: UDP, length 11
16:38:03.159657 IP 111.221.74.22.40011 > 10.11.3.3.7416: UDP, length 11
16:38:03.161716 IP 157.56.52.45.40024 > 10.11.3.3.7416: UDP, length 22
16:38:03.162227 IP 111.221.77.159.40023 > 10.11.3.3.7416: UDP, length 11
16:38:03.173400 IP 111.221.74.32.40029 > 10.11.3.3.7416: UDP, length 11
16:38:03.177630 IP 10.11.3.3.7416 > 157.55.56.169.40003: UDP, length 41
16:38:03.177640 IP 10.11.3.3.7416 > 111.221.74.22.40011: UDP, length 433
16:38:03.178688 IP 111.221.74.45.40023 > 10.11.3.3.7416: UDP, length 11
16:38:03.178882 IP 111.221.74.15.40004 > 10.11.3.3.7416: UDP, length 11
16:38:03.194236 IP 157.55.56.169.40003 > 10.11.3.3.7416: UDP, length 21
16:38:03.235315 IP 157.55.235.173.40024 > 10.11.3.3.7416: UDP, length 22
16:38:03.412825 IP 111.221.74.22.40011 > 10.11.3.3.7416: UDP, length 17
16:38:03.433136 IP 157.55.235.168.40011 > 10.11.3.3.60862: Flags [P.], seq 271:275, ack 1248, win 33, options [nop,nop,TS val 2276424415 ecr 1831700], length 4
16:38:03.549767 IP 10.11.3.3.60862 > 157.55.235.168.40011: Flags [.], ack 275, win 459, options [nop,nop,TS val 1831787 ecr 2276424415,nop,nop,sack 1 {271:275}], length 0
16:38:03.631235 IP 157.55.235.168.40011 > 10.11.3.3.60862: Flags [P.], seq 275:299, ack 1248, win 33, options [nop,nop,TS val 2276424464 ecr 1831787], length 24
16:38:03.654950 IP 10.11.3.3.60862 > 157.55.235.168.40011: Flags [.], ack 299, win 459, options [nop,nop,TS val 1831829 ecr 2276424464], length 0
16:38:04.970063 IP 10.11.3.3.7416 > 213.199.179.159.40023: UDP, length 41
16:38:04.970461 IP 10.11.3.3.7416 > 111.221.74.32.40029: UDP, length 41
16:38:04.970994 IP 10.11.3.3.7416 > 111.221.77.165.40028: UDP, length 428
16:38:04.971477 IP 10.11.3.3.7416 > 157.55.235.150.40011: UDP, length 428
16:38:04.971734 IP 10.11.3.3.7416 > 111.221.74.32.40029: UDP, length 428
16:38:04.972277 IP 10.11.3.3.7416 > 213.199.179.159.40023: UDP, length 428
16:38:04.972760 IP 10.11.3.3.7416 > 111.221.77.159.40023: UDP, length 428
16:38:04.973007 IP 10.11.3.3.7416 > 157.55.235.161.40001: UDP, length 428
16:38:04.973521 IP 10.11.3.3.7416 > 111.221.74.45.40023: UDP, length 428
16:38:04.973805 IP 10.11.3.3.7416 > 111.221.74.15.40004: UDP, length 428
16:38:05.053964 IP 157.55.235.161.40001 > 10.11.3.3.7416: UDP, length 17
16:38:05.054597 IP 157.55.235.150.40011 > 10.11.3.3.7416: UDP, length 17
16:38:05.058620 IP 213.199.179.159.40023 > 10.11.3.3.7416: UDP, length 21
16:38:05.060653 IP 213.199.179.159.40023 > 10.11.3.3.7416: UDP, length 17
16:38:05.080842 IP 10.11.3.3.7416 > 157.55.56.159.40023: UDP, length 41
16:38:05.097806 IP 157.55.56.159.40023 > 10.11.3.3.7416: UDP, length 21
16:38:05.190601 IP 111.221.77.165.40028 > 10.11.3.3.7416: UDP, length 17
16:38:05.202230 IP 111.221.77.159.40023 > 10.11.3.3.7416: UDP, length 17
16:38:05.206185 IP 111.221.74.32.40029 > 10.11.3.3.7416: UDP, length 21
16:38:05.207039 IP 111.221.74.32.40029 > 10.11.3.3.7416: UDP, length 17
16:38:05.217932 IP 111.221.74.45.40023 > 10.11.3.3.7416: UDP, length 17
16:38:05.218559 IP 111.221.74.15.40004 > 10.11.3.3.7416: UDP, length 17
16:38:06.058412 IP 10.11.3.3.60862 > 157.55.235.168.40011: Flags [P.], seq 1248:1293, ack 299, win 459, options [nop,nop,TS val 1832287 ecr 2276424464], length 45
16:38:06.140015 IP 157.55.235.168.40011 > 10.11.3.3.60862: Flags [P.], seq 299:303, ack 1293, win 33, options [nop,nop,TS val 2276425091 ecr 1832287], length 4
16:38:06.163835 IP 10.11.3.3.60862 > 157.55.235.168.40011: Flags [.], ack 303, win 459, options [nop,nop,TS val 1832330 ecr 2276425091], length 0
16:38:06.579414 IP 10.11.3.3.56204 > 74.125.228.39.443: Flags [P.], seq 111496122:111496627, ack 2793713774, win 762, options [nop,nop,TS val 1832412 ecr 756798082], length 505
16:38:06.800938 IP 10.11.3.3.56204 > 74.125.228.39.443: Flags [P.], seq 0:505, ack 1, win 762, options [nop,nop,TS val 1832456 ecr 756798082], length 505
16:38:07.239850 IP 10.11.3.3.56204 > 74.125.228.39.443: Flags [P.], seq 0:505, ack 1, win 762, options [nop,nop,TS val 1832544 ecr 756798082], length 505
16:38:07.344568 IP 10.11.3.3.52270 > 172.16.0.23.53: 62150+ A? dsn2.d.skype.net. (34)
16:38:07.374619 IP 172.16.0.23.53 > 10.11.3.3.52270: 62150 9/0/0 CNAME dsn2.skype-dsn.akadns.net., A 157.55.56.154, A 157.55.56.170, A 157.55.56.175, A 157.56.52.39, A 111.221.74.30, A 111.221.74.32, A 111.221.74.46, A 157.55.56.147 (198)
16:38:07.975098 IP 10.11.3.3.60862 > 157.55.235.168.40011: Flags [P.], seq 1293:1429, ack 303, win 459, options [nop,nop,TS val 1832691 ecr 2276425091], length 136
16:38:07.976080 IP 10.11.3.3.7416 > 65.55.223.22.40011: UDP, length 428
16:38:07.976378 IP 10.11.3.3.7416 > 157.56.52.22.40011: UDP, length 428
16:38:07.976882 IP 10.11.3.3.7416 > 111.221.74.22.40011: UDP, length 428
16:38:07.977285 IP 10.11.3.3.7416 > 111.221.77.165.40028: UDP, length 428
16:38:07.977664 IP 10.11.3.3.7416 > 157.55.56.159.40023: UDP, length 428
16:38:07.978015 IP 10.11.3.3.7416 > 64.4.23.159.40023: UDP, length 428
16:38:07.978178 IP 10.11.3.3.7416 > 111.221.74.32.40029: UDP, length 428
16:38:07.978709 IP 65.55.223.22.40011 > 10.11.3.3.7416: UDP, length 17
16:38:07.978902 IP 10.11.3.3.7416 > 213.199.179.159.40023: UDP, length 428
16:38:07.979194 IP 10.11.3.3.7416 > 111.221.77.159.40023: UDP, length 428
16:38:07.979593 IP 10.11.3.3.7416 > 157.56.52.33.40001: UDP, length 428
16:38:07.979916 IP 10.11.3.3.7416 > 65.55.223.33.40001: UDP, length 428
16:38:07.980395 IP 10.11.3.3.7416 > 157.55.56.175.40023: UDP, length 428
16:38:07.980629 IP 10.11.3.3.7416 > 157.55.130.155.40008: UDP, length 428
16:38:07.980967 IP 10.11.3.3.7416 > 157.56.52.45.40024: UDP, length 428
16:38:07.981472 IP 10.11.3.3.7416 > 65.55.223.45.40024: UDP, length 428
16:38:07.981980 IP 10.11.3.3.7416 > 111.221.74.45.40023: UDP, length 428
16:38:07.982005 IP 157.55.130.155.40008 > 10.11.3.3.7416: UDP, length 17
16:38:07.982219 IP 65.55.223.33.40001 > 10.11.3.3.7416: UDP, length 17
16:38:07.982479 IP 10.11.3.3.7416 > 65.55.223.15.40004: UDP, length 428
16:38:07.984111 IP 65.55.223.45.40024 > 10.11.3.3.7416: UDP, length 17
16:38:07.985001 IP 65.55.223.15.40004 > 10.11.3.3.7416: UDP, length 17
16:38:07.994324 IP 157.55.56.159.40023 > 10.11.3.3.7416: UDP, length 17
16:38:07.997113 IP 157.55.56.175.40023 > 10.11.3.3.7416: UDP, length 17
16:38:08.042441 IP 64.4.23.159.40023 > 10.11.3.3.7416: UDP, length 17
16:38:08.043471 IP 157.56.52.22.40011 > 10.11.3.3.7416: UDP, length 17
16:38:08.047358 IP 157.56.52.33.40001 > 10.11.3.3.7416: UDP, length 17
16:38:08.047953 IP 157.56.52.45.40024 > 10.11.3.3.7416: UDP, length 17
16:38:08.056743 IP 157.55.235.168.40011 > 10.11.3.3.60862: Flags [P.], seq 303:307, ack 1429, win 37, options [nop,nop,TS val 2276425570 ecr 1832691], length 4
16:38:08.068227 IP 213.199.179.159.40023 > 10.11.3.3.7416: UDP, length 17
16:38:08.072535 IP 10.11.3.3.60862 > 157.55.235.168.40011: Flags [P.], seq 1429:1852, ack 307, win 459, options [nop,nop,TS val 1832712 ecr 2276425570], length 423
16:38:08.110728 IP 10.11.3.3.56204 > 74.125.228.39.443: Flags [P.], seq 0:505, ack 1, win 762, options [nop,nop,TS val 1832720 ecr 756798082], length 505
16:38:08.154296 IP 157.55.235.168.40011 > 10.11.3.3.60862: Flags [P.], seq 307:311, ack 1852, win 41, options [nop,nop,TS val 2276425595 ecr 1832712], length 4
16:38:08.197048 IP 111.221.77.165.40028 > 10.11.3.3.7416: UDP, length 17
16:38:08.208753 IP 111.221.77.159.40023 > 10.11.3.3.7416: UDP, length 17
16:38:08.210210 IP 10.11.3.3.60862 > 157.55.235.168.40011: Flags [.], ack 311, win 459, options [nop,nop,TS val 1832740 ecr 2276425595], length 0
16:38:08.212085 IP 111.221.74.22.40011 > 10.11.3.3.7416: UDP, length 17
16:38:08.213525 IP 111.221.74.32.40029 > 10.11.3.3.7416: UDP, length 17
16:38:08.226232 IP 111.221.74.45.40023 > 10.11.3.3.7416: UDP, length 17
16:38:09.254963 IP 10.11.3.3.7416 > 213.199.179.169.40003: UDP, length 41
16:38:09.345997 IP 213.199.179.169.40003 > 10.11.3.3.7416: UDP, length 21
16:38:09.885980 IP 10.11.3.3.56204 > 74.125.228.39.443: Flags [P.], seq 0:505, ack 1, win 762, options [nop,nop,TS val 1833073 ecr 756798082], length 505
16:38:10.987500 IP 10.11.3.3.60862 > 157.55.235.168.40011: Flags [P.], seq 1852:1897, ack 311, win 459, options [nop,nop,TS val 1833293 ecr 2276425595], length 45
16:38:11.069289 IP 157.55.235.168.40011 > 10.11.3.3.60862: Flags [P.], seq 311:315, ack 1897, win 41, options [nop,nop,TS val 2276426323 ecr 1833293], length 4
16:38:11.397952 IP 157.55.235.168.40011 > 10.11.3.3.60862: Flags [P.], seq 311:315, ack 1897, win 41, options [nop,nop,TS val 2276426406 ecr 1833293], length 4
16:38:11.512376 IP 10.11.3.3.60862 > 157.55.235.168.40011: Flags [.], ack 315, win 459, options [nop,nop,TS val 1833380 ecr 2276426406,nop,nop,sack 1 {311:315}], length 0
16:38:13.411618 IP 10.11.3.3.56204 > 74.125.228.39.443: Flags [P.], seq 0:505, ack 1, win 762, options [nop,nop,TS val 1833778 ecr 756798082], length 505
16:38:16.255162 IP 199.167.177.44.1227 > 10.11.3.3.58394: Flags [P.], seq 2479295064:2479295066, ack 2904445456, win 6, options [nop,nop,TS val 1821146779 ecr 992281], length 2
16:38:16.281174 IP 10.11.3.3.58394 > 199.167.177.44.1227: Flags [R], seq 2904445456, win 0, length 0
16:38:18.345008 IP 157.55.235.168.40011 > 10.11.3.3.60862: Flags [P.], seq 315:319, ack 1897, win 41, options [nop,nop,TS val 2276428142 ecr 1833380], length 4
16:38:18.415203 IP 10.11.3.3.60862 > 157.55.235.168.40011: Flags [.], ack 319, win 459, options [nop,nop,TS val 1834781 ecr 2276428142], length 0
16:38:18.496755 IP 157.55.235.168.40011 > 10.11.3.3.60862: Flags [P.], seq 319:516, ack 1897, win 41, options [nop,nop,TS val 2276428180 ecr 1834781], length 197
16:38:18.515159 IP 10.11.3.3.60862 > 157.55.235.168.40011: Flags [.], ack 516, win 492, options [nop,nop,TS val 1834801 ecr 2276428180], length 0
16:38:18.515643 IP 10.11.3.3.60862 > 157.55.235.168.40011: Flags [P.], seq 1897:1907, ack 516, win 492, options [nop,nop,TS val 1834801 ecr 2276428180], length 10
16:38:18.520638 IP 10.11.3.3.38966 > 130.245.64.214.38709: Flags [S], seq 92434323, win 13600, options [mss 1360,sackOK,TS val 1834802 ecr 0,nop,wscale 5], length 0
16:38:18.521285 IP 10.11.3.3.35191 > 98.234.24.51.30411: Flags [S], seq 2472475459, win 13600, options [mss 1360,sackOK,TS val 1834802 ecr 0,nop,wscale 5], length 0
16:38:18.522074 IP 10.11.3.3.45510 > 141.212.135.33.25080: Flags [S], seq 1009108791, win 13600, options [mss 1360,sackOK,TS val 1834802 ecr 0,nop,wscale 5], length 0
16:38:18.569097 IP 141.212.135.33.25080 > 10.11.3.3.45510: Flags [S.], seq 2556368166, ack 1009108792, win 8192, options [mss 1460,nop,wscale 8,sackOK,TS val 2484124 ecr 1834802], length 0
16:38:18.589921 IP 10.11.3.3.45510 > 141.212.135.33.25080: Flags [.], ack 1, win 425, options [nop,nop,TS val 1834816 ecr 2484124], length 0
16:38:18.591185 IP 10.11.3.3.45510 > 141.212.135.33.25080: Flags [P.], seq 1:65, ack 1, win 425, options [nop,nop,TS val 1834816 ecr 2484124], length 64
16:38:18.617776 IP 98.234.24.51.30411 > 10.11.3.3.35191: Flags [S.], seq 2470211531, ack 2472475460, win 8192, options [mss 1460,nop,wscale 8,sackOK,TS val 17923009 ecr 1834802], length 0
16:38:18.630888 IP 10.11.3.3.35191 > 98.234.24.51.30411: Flags [.], ack 1, win 425, options [nop,nop,TS val 1834824 ecr 17923009], length 0
16:38:18.631662 IP 10.11.3.3.35191 > 98.234.24.51.30411: Flags [P.], seq 1:100, ack 1, win 425, options [nop,nop,TS val 1834824 ecr 17923009], length 99
16:38:18.634215 IP 157.55.235.168.40011 > 10.11.3.3.60862: Flags [.], ack 1907, win 41, options [nop,nop,TS val 2276428215 ecr 1834801], length 0
16:38:18.638942 IP 141.212.135.33.25080 > 10.11.3.3.45510: Flags [P.], seq 1:77, ack 65, win 258, options [nop,nop,TS val 2484131 ecr 1834816], length 76
16:38:18.651686 IP 10.11.3.3.45510 > 141.212.135.33.25080: Flags [.], ack 77, win 425, options [nop,nop,TS val 1834828 ecr 2484131], length 0
16:38:18.653387 IP 10.11.3.3.45510 > 141.212.135.33.25080: Flags [P.], seq 65:73, ack 77, win 425, options [nop,nop,TS val 1834828 ecr 2484131], length 8
16:38:18.698552 IP 141.212.135.33.25080 > 10.11.3.3.45510: Flags [P.], seq 77:85, ack 65, win 258, options [nop,nop,TS val 2484137 ecr 1834828], length 8
16:38:18.728366 IP 98.234.24.51.30411 > 10.11.3.3.35191: Flags [P.], seq 1:84, ack 100, win 258, options [nop,nop,TS val 17923020 ecr 1834824], length 83
16:38:18.741217 IP 10.11.3.3.35191 > 98.234.24.51.30411: Flags [.], ack 84, win 425, options [nop,nop,TS val 1834846 ecr 17923020], length 0
16:38:18.742242 IP 10.11.3.3.35191 > 98.234.24.51.30411: Flags [P.], seq 100:108, ack 84, win 425, options [nop,nop,TS val 1834846 ecr 17923020], length 8
16:38:18.759459 IP 10.11.3.3.45510 > 141.212.135.33.25080: Flags [.], ack 85, win 425, options [nop,nop,TS val 1834850 ecr 2484137], length 0
16:38:18.806616 IP 141.212.135.33.25080 > 10.11.3.3.45510: Flags [P.], seq 85:155, ack 73, win 257, options [nop,nop,TS val 2484148 ecr 1834828], length 70
16:38:18.820114 IP 10.11.3.3.45510 > 141.212.135.33.25080: Flags [P.], seq 73:97, ack 155, win 425, options [nop,nop,TS val 1834862 ecr 2484148], length 24
16:38:18.838484 IP 98.234.24.51.30411 > 10.11.3.3.35191: Flags [P.], seq 84:92, ack 100, win 258, options [nop,nop,TS val 17923031 ecr 1834846], length 8
16:38:18.889242 IP 10.11.3.3.35191 > 98.234.24.51.30411: Flags [.], ack 92, win 425, options [nop,nop,TS val 1834876 ecr 17923031], length 0
16:38:18.985135 IP 98.234.24.51.30411 > 10.11.3.3.35191: Flags [P.], seq 92:137, ack 108, win 257, options [nop,nop,TS val 17923046 ecr 1834846], length 45
16:38:19.005616 IP 10.11.3.3.35191 > 98.234.24.51.30411: Flags [P.], seq 108:150, ack 137, win 425, options [nop,nop,TS val 1834899 ecr 17923046], length 42
16:38:19.069052 IP 141.212.135.33.25080 > 10.11.3.3.45510: Flags [.], ack 97, win 257, options [nop,nop,TS val 2484174 ecr 1834862], length 0
16:38:19.089842 IP 10.11.3.3.45510 > 141.212.135.33.25080: Flags [P.], seq 97:112, ack 155, win 425, options [nop,nop,TS val 1834916 ecr 2484174], length 15
16:38:19.136650 IP 141.212.135.33.25080 > 10.11.3.3.45510: Flags [P.], seq 155:177, ack 112, win 257, options [nop,nop,TS val 2484181 ecr 1834916], length 22
16:38:19.150526 IP 10.11.3.3.7416 > 157.55.130.145.40001: UDP, length 41
16:38:19.150782 IP 10.11.3.3.7416 > 157.56.52.22.40011: UDP, length 41
16:38:19.152325 IP 157.55.130.145.40001 > 10.11.3.3.7416: UDP, length 643
16:38:19.190475 IP 10.11.3.3.45510 > 141.212.135.33.25080: Flags [.], ack 177, win 425, options [nop,nop,TS val 1834936 ecr 2484181], length 0
16:38:19.217989 IP 157.56.52.22.40011 > 10.11.3.3.7416: UDP, length 641
16:38:19.237439 IP 141.212.135.33.25080 > 10.11.3.3.45510: Flags [P.], seq 177:190, ack 112, win 257, options [nop,nop,TS val 2484191 ecr 1834936], length 13
16:38:19.253565 IP 10.11.3.3.45510 > 141.212.135.33.25080: Flags [.], ack 190, win 425, options [nop,nop,TS val 1834948 ecr 2484191], length 0
16:38:19.254875 IP 10.11.3.3.45510 > 141.212.135.33.25080: Flags [P.], seq 112:116, ack 190, win 425, options [nop,nop,TS val 1834948 ecr 2484191], length 4
16:38:19.304107 IP 98.234.24.51.30411 > 10.11.3.3.35191: Flags [.], ack 150, win 257, options [nop,nop,TS val 17923078 ecr 1834899], length 0
16:38:19.319824 IP 10.11.3.3.35191 > 98.234.24.51.30411: Flags [P.], seq 150:165, ack 137, win 425, options [nop,nop,TS val 1834961 ecr 17923078], length 15
16:38:19.414817 IP 98.234.24.51.30411 > 10.11.3.3.35191: Flags [P.], seq 137:159, ack 165, win 257, options [nop,nop,TS val 17923089 ecr 1834961], length 22
16:38:19.443050 IP 10.11.3.3.51179 > 131.156.89.80.30920: Flags [S], seq 3941098655, win 13600, options [mss 1360,sackOK,TS val 1834986 ecr 0,nop,wscale 5], length 0
16:38:19.447413 IP 10.11.3.3.50192 > 70.225.137.125.56852: Flags [S], seq 43050558, win 13600, options [mss 1360,sackOK,TS val 1834987 ecr 0,nop,wscale 5], length 0
16:38:19.475517 IP 10.11.3.3.35191 > 98.234.24.51.30411: Flags [.], ack 159, win 425, options [nop,nop,TS val 1834993 ecr 17923089], length 0
16:38:19.482063 IP 131.156.89.80.30920 > 10.11.3.3.51179: Flags [S.], seq 1936338467, ack 3941098656, win 17680, options [mss 1460,nop,wscale 0,nop,nop,TS val 0 ecr 0,nop,nop,sackOK], length 0
16:38:19.503107 IP 70.225.137.125.56852 > 10.11.3.3.50192: Flags [S.], seq 918838075, ack 43050559, win 8192, options [mss 1440,sackOK,TS val 27733428 ecr 1834987], length 0
16:38:19.506087 IP 141.212.135.33.25080 > 10.11.3.3.45510: Flags [.], ack 116, win 257, options [nop,nop,TS val 2484218 ecr 1834948], length 0
16:38:19.511812 IP 10.11.3.3.51179 > 131.156.89.80.30920: Flags [.], ack 1, win 425, options [nop,nop,TS val 1835000 ecr 0], length 0
16:38:19.518968 IP 10.11.3.3.50192 > 70.225.137.125.56852: Flags [.], ack 1, win 13600, options [nop,nop,TS val 1835001 ecr 27733428], length 0
16:38:19.520252 IP 10.11.3.3.51179 > 131.156.89.80.30920: Flags [P.], seq 1:91, ack 1, win 425, options [nop,nop,TS val 1835001 ecr 0], length 90
16:38:19.527993 IP 10.11.3.3.50192 > 70.225.137.125.56852: Flags [P.], seq 1:100, ack 1, win 13600, options [nop,nop,TS val 1835003 ecr 27733428], length 99
16:38:19.558476 IP 131.156.89.80.30920 > 10.11.3.3.51179: Flags [P.], seq 1:73, ack 91, win 17590, options [nop,nop,TS val 2860312 ecr 1835001], length 72
16:38:19.573033 IP 98.234.24.51.30411 > 10.11.3.3.35191: Flags [P.], seq 159:172, ack 165, win 257, options [nop,nop,TS val 17923105 ecr 1834993], length 13
16:38:19.573906 IP 10.11.3.3.51179 > 131.156.89.80.30920: Flags [.], ack 73, win 425, options [nop,nop,TS val 1835012 ecr 2860312], length 0
16:38:19.580585 IP 10.11.3.3.51179 > 131.156.89.80.30920: Flags [P.], seq 91:99, ack 73, win 425, options [nop,nop,TS val 1835014 ecr 2860312], length 8
16:38:19.588119 IP 70.225.137.125.56852 > 10.11.3.3.50192: Flags [P.], seq 1:73, ack 100, win 64704, options [nop,nop,TS val 27733436 ecr 1835003], length 72
16:38:19.588525 IP 10.11.3.3.35191 > 98.234.24.51.30411: Flags [.], ack 172, win 425, options [nop,nop,TS val 1835015 ecr 17923105], length 0
16:38:19.589781 IP 10.11.3.3.35191 > 98.234.24.51.30411: Flags [P.], seq 165:169, ack 172, win 425, options [nop,nop,TS val 1835015 ecr 17923105], length 4
16:38:19.603388 IP 10.11.3.3.50192 > 70.225.137.125.56852: Flags [.], ack 73, win 13600, options [nop,nop,TS val 1835018 ecr 27733436], length 0
16:38:19.610515 IP 10.11.3.3.50192 > 70.225.137.125.56852: Flags [P.], seq 100:108, ack 73, win 13600, options [nop,nop,TS val 1835020 ecr 27733436], length 8
16:38:19.613498 IP 131.156.89.80.30920 > 10.11.3.3.51179: Flags [P.], seq 73:81, ack 91, win 17590, options [nop,nop,TS val 2860314 ecr 1835012], length 8
16:38:19.661238 IP 70.225.137.125.56852 > 10.11.3.3.50192: Flags [P.], seq 73:81, ack 100, win 64704, options [nop,nop,TS val 27733444 ecr 1835018], length 8
16:38:19.665558 IP 10.11.3.3.51179 > 131.156.89.80.30920: Flags [.], ack 81, win 425, options [nop,nop,TS val 1835031 ecr 2860314], length 0
16:38:19.704673 IP 131.156.89.80.30920 > 10.11.3.3.51179: Flags [P.], seq 81:151, ack 99, win 17582, options [nop,nop,TS val 2860315 ecr 1835031], length 70
16:38:19.715765 IP 10.11.3.3.50192 > 70.225.137.125.56852: Flags [.], ack 81, win 13600, options [nop,nop,TS val 1835041 ecr 27733444], length 0
16:38:19.720649 IP 10.11.3.3.51179 > 131.156.89.80.30920: Flags [P.], seq 99:147, ack 151, win 425, options [nop,nop,TS val 1835041 ecr 2860315], length 48
16:38:19.775063 IP 70.225.137.125.56852 > 10.11.3.3.50192: Flags [P.], seq 81:135, ack 108, win 64696, options [nop,nop,TS val 27733455 ecr 1835020], length 54
16:38:19.798199 IP 10.11.3.3.50192 > 70.225.137.125.56852: Flags [P.], seq 108:164, ack 135, win 13600, options [nop,nop,TS val 1835057 ecr 27733455], length 56
16:38:19.882681 IP 98.234.24.51.30411 > 10.11.3.3.35191: Flags [.], ack 169, win 257, options [nop,nop,TS val 17923136 ecr 1835015], length 0
16:38:19.913705 IP 131.156.89.80.30920 > 10.11.3.3.51179: Flags [.], ack 147, win 17534, options [nop,nop,TS val 2860317 ecr 1835041], length 0
16:38:19.929772 IP 10.11.3.3.51179 > 131.156.89.80.30920: Flags [P.], seq 147:160, ack 151, win 425, options [nop,nop,TS val 1835083 ecr 2860317], length 13
16:38:19.967491 IP 131.156.89.80.30920 > 10.11.3.3.51179: Flags [P.], seq 151:169, ack 160, win 17521, options [nop,nop,TS val 2860317 ecr 1835083], length 18
16:38:20.019637 IP 10.11.3.3.51179 > 131.156.89.80.30920: Flags [.], ack 169, win 425, options [nop,nop,TS val 1835102 ecr 2860317], length 0
16:38:20.054287 IP 70.225.137.125.56852 > 10.11.3.3.50192: Flags [.], ack 164, win 64640, options [nop,nop,TS val 27733483 ecr 1835057], length 0
16:38:20.067075 IP 10.11.3.3.50192 > 70.225.137.125.56852: Flags [P.], seq 164:177, ack 135, win 13600, options [nop,nop,TS val 1835111 ecr 27733483], length 13
16:38:20.124968 IP 70.225.137.125.56852 > 10.11.3.3.50192: Flags [P.], seq 135:153, ack 177, win 64627, options [nop,nop,TS val 27733490 ecr 1835111], length 18
16:38:20.139284 IP 10.11.3.3.38971 > 130.245.64.214.38709: Flags [S], seq 3556329757, win 13600, options [mss 1360,sackOK,TS val 1835124 ecr 0,nop,wscale 5], length 0
16:38:20.179362 IP 10.11.3.3.50192 > 70.225.137.125.56852: Flags [.], ack 153, win 13600, options [nop,nop,TS val 1835134 ecr 27733490], length 0
16:38:20.460034 IP 10.11.3.3.56204 > 74.125.228.39.443: Flags [P.], seq 0:505, ack 1, win 762, options [nop,nop,TS val 1835188 ecr 756798082], length 505
16:38:20.667044 IP 10.11.3.3.35191 > 98.234.24.51.30411: Flags [P.], seq 169:953, ack 172, win 425, options [nop,nop,TS val 1835231 ecr 17923136], length 784
16:38:20.668901 IP 10.11.3.3.45510 > 141.212.135.33.25080: Flags [P.], seq 116:900, ack 190, win 425, options [nop,nop,TS val 1835231 ecr 2484218], length 784
16:38:20.669411 IP 10.11.3.3.51179 > 131.156.89.80.30920: Flags [P.], seq 160:944, ack 169, win 425, options [nop,nop,TS val 1835231 ecr 2860317], length 784
16:38:20.669917 IP 10.11.3.3.50192 > 70.225.137.125.56852: Flags [P.], seq 177:961, ack 153, win 13600, options [nop,nop,TS val 1835231 ecr 27733490], length 784
16:38:20.883055 IP 131.156.89.80.30920 > 10.11.3.3.51179: Flags [P.], seq 169:182, ack 944, win 16737, options [nop,nop,TS val 2860326 ecr 1835231], length 13
16:38:20.911445 IP 70.225.137.125.56852 > 10.11.3.3.50192: Flags [P.], seq 153:166, ack 961, win 63843, options [nop,nop,TS val 27733568 ecr 1835231], length 13
16:38:20.915144 IP 141.212.135.33.25080 > 10.11.3.3.45510: Flags [.], ack 900, win 254, options [nop,nop,TS val 2484359 ecr 1835231], length 0
16:38:20.962953 IP 98.234.24.51.30411 > 10.11.3.3.35191: Flags [.], ack 953, win 254, options [nop,nop,TS val 17923244 ecr 1835231], length 0
16:38:21.027119 IP 10.11.3.3.50192 > 70.225.137.125.56852: Flags [.], ack 166, win 13600, options [nop,nop,TS val 1835283 ecr 27733568], length 0
16:38:21.029007 IP 10.11.3.3.50192 > 70.225.137.125.56852: Flags [P.], seq 961:965, ack 166, win 13600, options [nop,nop,TS val 1835283 ecr 27733568], length 4
16:38:21.053406 IP 141.212.135.33.25080 > 10.11.3.3.45510: Flags [P.], seq 190:1405, ack 900, win 254, options [nop,nop,TS val 2484373 ecr 1835231], length 1215
16:38:21.087878 IP 70.225.137.125.56852 > 10.11.3.3.50192: Flags [P.], seq 166:196, ack 961, win 63843, options [nop,nop,TS val 27733586 ecr 1835283], length 30
16:38:21.115508 IP 10.11.3.3.45510 > 141.212.135.33.25080: Flags [.], ack 1405, win 510, options [nop,nop,TS val 1835321 ecr 2484373], length 0
16:38:21.153970 IP 10.11.3.3.35191 > 98.234.24.51.30411: Flags [P.], seq 953:1501, ack 172, win 425, options [nop,nop,TS val 1835321 ecr 17923244], length 548
16:38:21.153988 IP 10.11.3.3.45510 > 141.212.135.33.25080: Flags [P.], seq 900:1448, ack 1405, win 510, options [nop,nop,TS val 1835322 ecr 2484373], length 548
16:38:21.154024 IP 10.11.3.3.50192 > 70.225.137.125.56852: Flags [.], ack 196, win 13600, options [nop,nop,TS val 1835326 ecr 27733586], length 0
16:38:21.215561 IP 98.234.24.51.30411 > 10.11.3.3.35191: Flags [P.], seq 172:1387, ack 953, win 254, options [nop,nop,TS val 17923269 ecr 1835231], length 1215
16:38:21.275764 IP 10.11.3.3.35191 > 98.234.24.51.30411: Flags [.], ack 1387, win 510, options [nop,nop,TS val 1835353 ecr 17923269], length 0
16:38:21.290993 IP 70.225.137.125.56852 > 10.11.3.3.50192: Flags [.], ack 965, win 63839, options [nop,nop,TS val 27733607 ecr 1835283], length 0
16:38:21.307819 IP 10.11.3.3.50192 > 70.225.137.125.56852: Flags [P.], seq 965:1513, ack 196, win 13600, options [nop,nop,TS val 1835359 ecr 27733607], length 548
16:38:21.320841 IP 10.11.3.3.51179 > 131.156.89.80.30920: Flags [P.], seq 944:948, ack 182, win 425, options [nop,nop,TS val 1835362 ecr 2860326], length 4
16:38:21.358380 IP 131.156.89.80.30920 > 10.11.3.3.51179: Flags [P.], seq 182:242, ack 948, win 16733, options [nop,nop,TS val 2860331 ecr 1835362], length 60
16:38:21.378781 IP 98.234.24.51.30411 > 10.11.3.3.35191: Flags [P.], seq 1387:2279, ack 1501, win 258, options [nop,nop,TS val 17923286 ecr 1835321], length 892
16:38:21.385708 IP 10.11.3.3.51179 > 131.156.89.80.30920: Flags [P.], seq 948:1496, ack 242, win 425, options [nop,nop,TS val 1835372 ecr 2860331], length 548
16:38:21.402426 IP 141.212.135.33.25080 > 10.11.3.3.45510: Flags [.], ack 1448, win 258, options [nop,nop,TS val 2484408 ecr 1835322], length 0
16:38:21.406724 IP 10.11.3.3.35191 > 98.234.24.51.30411: Flags [P.], seq 1501:2017, ack 2279, win 594, options [nop,nop,TS val 1835376 ecr 17923286], length 516
16:38:21.406735 IP 10.11.3.3.45510 > 141.212.135.33.25080: Flags [P.], seq 1448:1476, ack 1405, win 510, options [nop,nop,TS val 1835376 ecr 2484373], length 28
16:38:21.408707 IP 10.11.3.3.45510 > 141.212.135.33.25080: Flags [P.], seq 1476:1503, ack 1405, win 510, options [nop,nop,TS val 1835378 ecr 2484373], length 27
16:38:21.409227 IP 10.11.3.3.45510 > 141.212.135.33.25080: Flags [P.], seq 1503:1531, ack 1405, win 510, options [nop,nop,TS val 1835379 ecr 2484373], length 28
16:38:21.411791 IP 10.11.3.3.45510 > 141.212.135.33.25080: Flags [P.], seq 1531:1558, ack 1405, win 510, options [nop,nop,TS val 1835380 ecr 2484373], length 27
16:38:21.455599 IP 141.212.135.33.25080 > 10.11.3.3.45510: Flags [.], ack 1503, win 257, options [nop,nop,TS val 2484413 ecr 1835376], length 0
16:38:21.458925 IP 141.212.135.33.25080 > 10.11.3.3.45510: Flags [.], ack 1558, win 257, options [nop,nop,TS val 2484413 ecr 1835379], length 0
16:38:21.496054 IP 10.11.3.3.7416 > 98.234.24.51.30411: UDP, length 23
16:38:21.496083 IP 10.11.3.3.7416 > 141.212.135.33.25080: UDP, length 23
16:38:21.497022 IP 10.11.3.3.7416 > 131.156.89.80.30920: UDP, length 21
16:38:21.497035 IP 10.11.3.3.7416 > 70.225.137.125.56852: UDP, length 21
16:38:21.534862 IP 131.156.89.80.30920 > 10.11.3.3.7416: UDP, length 21
16:38:21.542223 IP 141.212.135.33.25080 > 10.11.3.3.45510: Flags [P.], seq 1405:1433, ack 1558, win 257, options [nop,nop,TS val 2484422 ecr 1835379], length 28
16:38:21.543802 IP 141.212.135.33.25080 > 10.11.3.3.7416: UDP, length 22
16:38:21.550786 IP 70.225.137.125.56852 > 10.11.3.3.7416: UDP, length 21
16:38:21.554403 IP 131.156.89.80.30920 > 10.11.3.3.51179: Flags [.], ack 1496, win 17680, options [nop,nop,TS val 2860333 ecr 1835372], length 0
16:38:21.555308 IP 10.11.3.3.45510 > 141.212.135.33.25080: Flags [.], ack 1433, win 510, options [nop,nop,TS val 1835409 ecr 2484422], length 0
16:38:21.570746 IP 70.225.137.125.56852 > 10.11.3.3.50192: Flags [.], ack 1513, win 64704, options [nop,nop,TS val 27733635 ecr 1835359], length 0
16:38:21.594573 IP 98.234.24.51.30411 > 10.11.3.3.7416: UDP, length 21
16:38:21.602278 IP 141.212.135.33.25080 > 10.11.3.3.45510: Flags [P.], seq 1433:1482, ack 1558, win 257, options [nop,nop,TS val 2484428 ecr 1835409], length 49
16:38:21.606314 IP 10.11.3.3.51179 > 131.156.89.80.30920: Flags [P.], seq 1496:1511, ack 242, win 425, options [nop,nop,TS val 1835419 ecr 2860333], length 15
16:38:21.606876 IP 10.11.3.3.45510 > 141.212.135.33.25080: Flags [P.], seq 1558:1573, ack 1433, win 510, options [nop,nop,TS val 1835419 ecr 2484422], length 15
16:38:21.607570 IP 10.11.3.3.50192 > 70.225.137.125.56852: Flags [P.], seq 1513:1527, ack 196, win 13600, options [nop,nop,TS val 1835419 ecr 27733635], length 14
16:38:21.615579 IP 10.11.3.3.45510 > 141.212.135.33.25080: Flags [.], ack 1482, win 510, options [nop,nop,TS val 1835421 ecr 2484428], length 0
16:38:21.639611 IP 98.234.24.51.30411 > 10.11.3.3.35191: Flags [P.], seq 2279:2319, ack 2017, win 256, options [nop,nop,TS val 17923311 ecr 1835376], length 40
16:38:21.644676 IP 131.156.89.80.30920 > 10.11.3.3.51179: Flags [P.], seq 242:246, ack 1511, win 17665, options [nop,nop,TS val 2860333 ecr 1835419], length 4
16:38:21.659074 IP 10.11.3.3.35191 > 98.234.24.51.30411: Flags [P.], seq 2017:2899, ack 2319, win 594, options [nop,nop,TS val 1835428 ecr 17923311], length 882
16:38:21.659085 IP 10.11.3.3.7416 > 141.212.135.33.25080: UDP, length 20
16:38:21.662476 IP 141.212.135.33.25080 > 10.11.3.3.45510: Flags [P.], seq 1482:1486, ack 1573, win 257, options [nop,nop,TS val 2484434 ecr 1835419], length 4
16:38:21.668757 IP 70.225.137.125.56852 > 10.11.3.3.50192: Flags [P.], seq 196:200, ack 1527, win 64690, options [nop,nop,TS val 27733645 ecr 1835419], length 4
16:38:21.675692 IP 10.11.3.3.45510 > 141.212.135.33.25080: Flags [.], ack 1486, win 510, options [nop,nop,TS val 1835433 ecr 2484434], length 0
16:38:21.681784 IP 10.11.3.3.50192 > 70.225.137.125.56852: Flags [.], ack 200, win 13600, options [nop,nop,TS val 1835434 ecr 27733645], length 0
16:38:21.695102 IP 10.11.3.3.51179 > 131.156.89.80.30920: Flags [.], ack 246, win 425, options [nop,nop,TS val 1835437 ecr 2860333], length 0
